title,link,date,abstract
"Mercato Roma, Rios è il preferito di Gasperini: primo contatto con il Palmeiras", "https://www.forzaroma.info/calciomercato-as-roma/mercato-roma-rios-e-il-preferito-di-gasperini-primo-contatto-con-il-palmeiras/", "7 luglio 2025", "Nella notte c'è stato un primo contatto tra i giallorossi ed il club brasiliano"
"Everton-Roma, giovedì parte la vendita libera: i prezzi dei biglietti e tutte le info", "https://www.forzaroma.info/news-as-roma/everton-roma-giovedi-parte-la-vendita-libera-i-prezzi-dei-biglietti-e-tutte-le-info/", "7 luglio 2025", "I giallorossi scenderanno in campo contro i Toffees il prossimo 9 agosto. Dopo il..."
"Roma, nodo attaccante. Per Krstovic e Lucca sparano alto: 40 milioni", "https://www.forzaroma.info/news-as-roma/roma-nodo-attaccante-per-krstovic-e-lucca-sparano-alto-40-milioni/", "7 luglio 2025", "Per Gasp il montenegrino è il profilo ideale da alternare con Dovbyk. Intanto il..."
"Da Wesley a Ortiz fino al talento Rayan: gli affari dell’estate arrivano dal Brasile", "https://www.forzaroma.info/rassegna-stampa/il-messaggero/da-wesley-a-ortiz-fino-al-talento-rayan-gli-affari-dellestate-arrivano-dal-brasile/", "7 luglio 2025", "Terzini, difensori e punte: Massara studia l'occasione. Nel mirino anche lo..."
"Trequarti di Roma", "https://www.forzaroma.info/rassegna-stampa/il-messaggero/trequarti-di-roma/", "7 luglio 2025", "Mancano sei giorni al raduno, Gasp attende i primi rinforzi. Con Pellegrini e..."
"È la settimana di Wesley. O’Riley: la chiave è Elliot", "https://www.forzaroma.info/rassegna-stampa/la-gazzetta-dello-sport/e-la-settimana-di-wesley-oriley-la-chiave-e-elliot/", "7 luglio 2025", "Massara vuole regalare i primi rinforzi a Gasperini in vista del raduno di..."
"Paredes e Shomu in uscita. Attesa Wesley", "https://www.forzaroma.info/rassegna-stampa/il-tempo/paredes-e-shomu-in-uscita-attesa-wesley/", "7 luglio 2025", "Il Flamengo continua a chiedere quasi 30 milioni per l'esterno brasiliano. Il..."
"Boniek: “Gasperini una garanzia. Nessun rapporto con i Friedkin”", "https://www.forzaroma.info/rassegna-stampa/il-tempo/boniek-non-ha-dubbi-gasperini-una-garanzia-tornare-a-roma-lho-detto-tante-volte/", "7 luglio 2025", "Le sue parole: "Gasp è uno con esperienza. Poi, se è una scelta di Ranieri, sono..."
"Roma a caccia del bomber: Mikautadze, Lucca o Krstovic", "https://www.forzaroma.info/rassegna-stampa-roma/leggo/roma-a-caccia-del-bomber-mikautadze-lucca-o-krstovic/", "7 luglio 2025", "Il tecnico aspetta colpi nel reparto offensivo. In pole c'è il georgiano del Lione"
"Wesley, indizio social: spunta un like al post della Roma- FOTO", "https://www.forzaroma.info/news-as-roma/wesley-indizio-social-spunta-un-like-al-post-della-roma-foto/", "6 luglio 2025", "Il giocatore brasiliano è da diversi giorni accostato ai giallorossi. Sui social..."
"Mercato, dalla Turchia: il Besiktas vuole Celik. Arriva il “no” della Roma", "https://www.forzaroma.info/calciomercato-as-roma/mercato-dalla-turchia-il-besiktas-vuole-celik-ma-la-roma-non-vuole-venderlo/", "6 luglio 2025", "I giallorossi avrebbero fatto sapere che vogliono rinnovare il contratto del..."
"Roma, per Lucca servono 40 milioni. Sfida con l’Inter per Kokcu. Atalanta su Krstovic", "https://www.forzaroma.info/news-as-roma/roma-per-lucca-servono-40-milioni-sfida-con-linter-per-kokcu-atalanta-su-krstovic/", "6 luglio 2025", "Il Bologna dice "no" al Galatasray che ha offerto 15 milioni per Lucumì. In porta..."
"Abdulhamid, allenamento in palestra per l’inizio della nuova stagione- FOTO", "https://www.forzaroma.info/news-as-roma/abdulhamid-allenamento-in-palestra-per-linizio-della-nuova-stagione-foto/", "6 luglio 2025", "Il terzino arabo ha condiviso uno scatto sui social in cui mostra come si sta..."
"Mercato Roma, il Galatasaray offre 15 milioni per Lucumì: il Bologna rifiuta", "https://www.forzaroma.info/news-as-roma/mercato-roma-il-galatasaray-offre-15-milioni-per-lucumi-il-bologna-rifiuta/", "6 luglio 2025", "Il club emiliano avrebbe rifiutato la proposta della squadra turca. Massara..."
"Panucci: “A Gasperini serve tempo per lavorare bene. Massara? Grande professionista”", "https://www.forzaroma.info/news-as-roma/panucci-a-gasperini-serve-tempo-per-lavorare-bene-massara-grande-professionista/", "6 luglio 2025", "L'ex giocatore giallorosso si è espresso su quello che sarà il nuovo ciclo per la..."
"Mercato, la Roma osserva Falcone: su di lui anche Napoli e Torino", "https://www.forzaroma.info/news-as-roma/mercato-la-roma-osserva-falcone-su-di-lui-anche-napoli-e-torino/", "6 luglio 2025", "Il portiere del club salentino è frutto d'interesse di diversi club della Serie A,..."
"Roma, Gasperini è il terzo allenatore più pagato della Serie A: ecco la top 5", "https://www.forzaroma.info/news-as-roma/roma-gasperini-e-il-terzo-allenatore-piu-pagato-della-serie-a-ecco-la-top-5/", "6 luglio 2025", "Con 5 milioni di euro all’anno, il tecnico di Grugliasco si prende il podio della..."
"Gallazzi saluta la Roma: è ufficiale il riscatto da parte del Sassuolo", "https://www.forzaroma.info/roma-femminile/gallazzi-saluta-la-roma-e-ufficiale-il-riscatto-da-parte-del-sassuolo/", "6 luglio 2025", "Il club emiliano ha deciso di puntare su di lei per il futuro, riconoscendole un..."
"Kokcu tra Roma e Inter: il Benfica apre, ma servono 40 milioni", "https://www.forzaroma.info/calciomercato-as-roma/kokcu-tra-roma-e-inter-il-benfica-apre-ma-servono-40-milioni/", "6 luglio 2025", "I nerazzurri lo hanno identificato come potenziale erede di Calhanoglu, nel caso..."
"Denis: “Gasperini ha rivoluzionato l’Atalanta, può ripetersi alla Roma”", "https://www.forzaroma.info/news-as-roma/denis-gasperini-ha-rivoluzionato-latalanta-puo-ripetersi-alla-roma/", "6 luglio 2025", "Le parole dell'ex attaccante del Napoli: "Gasp ha trasformato la Dea,..."
"Lecce, Sticchi Damiani su Krstovic: “Non abbiamo esigenza di cedere”", "https://www.forzaroma.info/calciomercato-as-roma/lecce-sticchi-damiani-su-krstovic-non-abbiamo-esigenza-di-cedere/", "6 luglio 2025", "Le parole del presidente del club salentino: "In questa fase del mercato c'é..."
"Krstovic piace alla Roma, ma anche l’Atalanta si muove: le ultime", "https://www.forzaroma.info/calciomercato-as-roma/krstovic-piace-alla-roma-ma-anche-latalanta-si-muove-le-ultime/", "6 luglio 2025", "Il profilo dell'attaccante montenegrino è molto apprezzato a Bergamo, dove i..."
"Flavio Cobolli: “I miei idoli? Djokovic, Fognini e… la Roma”", "https://www.forzaroma.info/news-as-roma/flavio-cobolli-i-miei-idoli-djokovic-fognini-e-la-roma/", "6 luglio 2025", "Le sue parole: "Da ragazzo ero un grande terzino destro, mi piaceva correre sulla..."
"Ufficiale, Farioli riparte dal Porto: biennale fino al 2027", "https://www.forzaroma.info/news-calcio/ufficiale-farioli-riparte-dal-porto-biennale-fino-al-2027/", "6 luglio 2025", "Dopo le tante voci, che lo vedevano anche come una possibile scelta per la nuova..."
"Donadoni: “Roma tra le possibili sorprese, molto dipenderà dal mercato”", "https://www.forzaroma.info/news-as-roma/donadoni-roma-tra-le-possibili-sorprese-molto-dipendera-dal-mercato/", "6 luglio 2025", "Le parole dell'ex CT dell'Italia: "L'Inter resta la più forte e il Napoli sta..."
"Il Benfica saluta Renato Sanches: “Obrigado”. L’ex Roma torna al PSG", "https://www.forzaroma.info/news-calcio/il-benfica-saluta-renato-sanches-obrigado-lex-roma-torna-al-psg/", "6 luglio 2025", "Il centrocampista portoghese era tornato in patria dopo l'infelice parentesi con i..."
"Leo Ortiz, l’ultima idea brasiliana della Roma: figlio d’arte tra Juve e...", "https://www.forzaroma.info/calciomercato-as-roma/leo-ortiz-lultima-idea-brasiliana-della-roma-figlio-darte-tra-juve-e-maxi-clausola/", "6 luglio 2025", "Il difensore brasiliano a gennaio compirà 30 anni, ma tanti club lo osservano:..."
"Ennio Morricone, il figlio Marco: “Roma traccia indelebile”. Poi l’aneddoto su...", "https://www.forzaroma.info/news-as-roma/ennio-morricone-il-figlio-marco-roma-traccia-indelebile-poi-laneddoto-su-spalletti/", "6 luglio 2025", "Marco Morricone racconta il padre e la sua passione per i colori giallorossi,..."
"Koné, sprint per Gasperini: allenamento in campo con Mbeumo del Brentford – FOTO", "https://www.forzaroma.info/news-as-roma/kone-sprint-per-gasperini-allenamento-in-campo-con-mbeumo-del-brentford-foto/", "6 luglio 2025", "Il centrocampista francese si sta preparando per il raduno di domenica prossima..."
"Saint-Maximin shock: “Il Fenerbahce voleva doparmi”. I turchi annunciano azioni...", "https://www.forzaroma.info/news-calcio/saint-maximin-shock-il-fenerbahce-voleva-doparmi-i-turchi-annunciano-azioni-legali/", "6 luglio 2025", "L'esterno francese accusa pesantemente la sua ex squadra, allenata da José..."
"Tutti pazzi per Lucca, Napoli in pole. Ma c’è anche la Roma: ha parlato con l’agente", "https://www.forzaroma.info/calciomercato-as-roma/tutti-pazzi-per-lucca-napoli-in-pole-ma-ce-anche-la-roma-ha-parlato-con-lagente/", "6 luglio 2025", "Il centravanti dell'Udinese piace alle big di Serie A, ma la richiesta è di 40..."
"Dovbyk guida i sotto esame", "https://www.forzaroma.info/rassegna-stampa/il-tempo/dovbyk-guida-i-sotto-esame/", "6 luglio 2025", "Domenica inizia il ritiro e in molti vogliono convincere Gasperini"
"Con Wesley c’è Ortiz: doppia trattativa con il Flamengo", "https://www.forzaroma.info/rassegna-stampa-roma/la-repubblica/con-wesley-ce-ortiz-doppia-trattativa-con-il-flamengo/", "6 luglio 2025", "A Massara piace il centrale brasiliano: sfida con la Juventus. Intanto saluta..."
"Rizzitelli: “Roma, ora 3 colpi. Scamacca, Wesley, Ederson e si vola”", "https://www.forzaroma.info/rassegna-stampa-roma/il-corriere-della-sera/rizzitelli-roma-ora-3-colpi-scamacca-wesley-ederson-e-si-vola/", "6 luglio 2025", "L'ex giallorosso: "Finalmente addio algoritmi. Gasp, Ranieri e Massara sanno cosa..."
"Soulé di corsa per Gasperini", "https://www.forzaroma.info/rassegna-stampa/il-messaggero/soule-di-corsa-per-gasperini/", "6 luglio 2025", "L'argentino anticipa tutti e si allena con un preparatore a Roma in attesa del 13..."
"Lecce, Corvino avvisa tutti su Krstovic: “Via al nostro prezzo”", "https://www.forzaroma.info/rassegna-stampa/la-gazzetta-dello-sport/lecce-corvino-avvisa-tutti-su-krstovic-via-al-nostro-prezzo/", "6 luglio 2025", "Il dg dei pugliesi sul bomber che piace alla Roma: "Ci sono attaccanti che hanno..."
"Non solo Wesley: nel mirino c’è pure Rayan Vitor. E piace Ortiz", "https://www.forzaroma.info/rassegna-stampa/la-gazzetta-dello-sport/non-solo-wesley-nel-mirino-ce-pure-rayan-vitor-e-piace-ortiz/", "6 luglio 2025", "Oltre al terzino del Flamengo, la Roma in Brasile segue altri due giovani talenti,..."
"Rilancio Pellegrini, missione possibile: conquistare Gasp. C’è in gioco la Roma", "https://www.forzaroma.info/rassegna-stampa/la-gazzetta-dello-sport/rilancio-pellegrini-missione-possibile-conquistare-gasp-ce-in-gioco-la-roma/", "6 luglio 2025", "Il capitano in scadenza tornerà al top a settembre: la lunga sfida per il rinnovo"
"Mercato Roma, primi sondaggi del Galatasaray per Svilar: offerta da 6 milioni l’anno", "https://www.forzaroma.info/news-as-roma/mercato-roma-il-galatasaray-vuole-svilar-offerti-6-milioni-lanno-al-portiere/", "5 luglio 2025", "Il club turco avrebbe messo gli occhi sull'estremo difensore serbo e starebbe..."
"Sinner svela il suo dream team italiano di calcio a 5: Totti in attacco – VIDEO", "https://www.forzaroma.info/news-as-roma/sinner-svela-il-suo-dream-team-italiano-di-calcio-a-5-totti-in-attacco-video/", "5 luglio 2025", "Il numero 1 al mondo nel ranking ATP ha rivelato quali sono i suoi cinque..."
"Roma, occhi su Rayan Vitor e Leo Ortiz. Sulla destra piace Ratiu. Sfuma De Cuyper", "https://www.forzaroma.info/news-as-roma/roma-occhi-su-rayan-vitor-e-leo-ortiz-sulla-destra-piace-ratiu-sfuma-de-cuyper/", "5 luglio 2025", "Si cerca un nuovo sponsor. Gerson indica la Roma a Wesley. Per Lucumì c'è un..."
"Taylor, clamorosi errori arbitrali in PSG-Bayern Monaco: cosa è successo", "https://www.forzaroma.info/news-as-roma/taylor-clamorosi-errori-arbitrali-in-psg-bayern-monaco-cosa-e-successo/", "5 luglio 2025", "Il direttore di gara inglese, dopo le polemiche della finale di Europa League 2023..."
"Trevisani: “Se Gasperini avrà tempo di lavorare la Roma tornerà sicuro in Champions”", "https://www.forzaroma.info/news-as-roma/trevisani-se-gasperini-avra-tempo-di-lavorare-la-roma-tornera-sicuro-in-champions/", "5 luglio 2025", "Il giornalista e opinionista tv si è soffermato su come sarà secondo lui la..."
"Saelemaekers ringrazia la Roma: “Quante emozioni insieme. Vi porterò sempre con me”", "https://www.forzaroma.info/senza-categoria/salemaekers-ringrazia-la-roma-quante-emozioni-insieme-vi-portero-sempre-con-me/", "5 luglio 2025", "Il giocatore belga sui social: "Ho lavorato duro per tornare, e quando l’ho fatto,..."
"Mercato Roma, piace anche Ratiu per la fascia destra: prezzo fissato a 25 milioni", "https://www.forzaroma.info/news-as-roma/mercato-roma-piace-anche-ratiu-per-la-fascia-destra-prezzo-fissato-a-25-milioni/", "5 luglio 2025", "Qualora Wesley non dovesse approdare nella Capitale, i giallorossi punterebbero..."
"Zortea: “Mi aspettavo l’interesse dei top club. Sono pronto per il salto”", "https://www.forzaroma.info/calciomercato-as-roma/zortea-mi-aspettavo-linteresse-dei-top-club-sono-pronto-per-il-salto/", "5 luglio 2025", "Le parole dell'esterno del Cagliari: "Penso di essere pronto e non vedo l'ora di..."
"Mercato Roma, sfuma De Cuyper: è ufficialmente un giocatore del Brighton", "https://www.forzaroma.info/calciomercato-as-roma/mercato-roma-sfuma-de-cuyper-e-ufficialmente-un-nuovo-giocatore-del-brighton/", "5 luglio 2025", "Il terzino belga del Club Brugge è stato a lungo l'obiettivo dei giallorossi per..."
"Rayan Vitor, il nuovo Leao pronto per l’Europa: la Roma ci aveva già provato a...", "https://www.forzaroma.info/calciomercato-as-roma/rayan-vitor-il-nuovo-leao-pronto-per-leuropa-la-roma-ci-aveva-gia-provato-a-gennaio/", "5 luglio 2025", "Non ha ancora compiuto 19 anni (lo farà il 3 agosto) ma ha già tutto per fare bene..."
